{
  "spdlVersion": "0.1",
  "metadata": {
    "processName": "SAP MM Goods Receipt (Wareneingang)",
    "processId": "SAP_MM_MIGO_001",
    "author": "Jean-Marc Erieau, PI360 gUG",
    "createdDate": "2026-06-03",
    "version": "1.0",
    "status": "Active",
    "domain": "Supply Chain / Materials Management",
    "description": "Complete goods receipt process in SAP MM with quality inspection, financial posting, and exception handling"
  },
  "processModel": {
    "processName": "SAP MM Goods Receipt",
    "purpose": "Record goods received from suppliers in inventory and accounting systems",
    "trigger": "Purchase Order (PO) created in SAP, Goods physically arrive at dock",
    "outcome": "Goods recorded in inventory, accounting entry posted, invoice can be matched",
    "frequency": "Daily (multiple times per day)",
    "volume": {
      "casesPerDay": 50,
      "casesPerMonth": 1000,
      "casesPerYear": 12000
    },
    "roles": [
      "Dock Supervisor",
      "Quality Engineer",
      "Warehouse Lead",
      "SAP User",
      "Senior Quality Engineer (Escalation)"
    ],
    "activities": [
      {
        "id": "receive_goods",
        "name": "Receive Goods at Dock",
        "semanticType": "PhysicalReceiving",
        "businessMeaning": "Accept goods delivery from supplier, verify labels, count units",
        "performer": "Dock Supervisor",
        "duration": "15-30 minutes",
        "durationMinutes": 22.5,
        "sequence": 1,
        "inputObjects": ["ShippingDocument", "PurchaseOrder"],
        "outputObjects": ["GoodsReceipt", "PhysicalCount"],
        "systemsInvolved": ["Manual", "Barcode Scanner"],
        "isManual": true,
        "kpisAffected": ["cycle_time", "first_touch_time"]
      },
      {
        "id": "quality_inspect",
        "name": "Quality Inspection",
        "semanticType": "QualityControl",
        "businessMeaning": "Inspect goods for damage, defects, correct specification",
        "performer": "Quality Engineer",
        "duration": "10-45 minutes",
        "durationMinutes": 27.5,
        "sequence": 2,
        "inputObjects": ["GoodsReceipt", "PurchaseOrder"],
        "outputObjects": ["InspectionReport", "QualityDecision"],
        "systemsInvolved": ["SAP QM", "Manual Documentation"],
        "isManual": true,
        "kpisAffected": ["quality_score", "defect_rate", "cycle_time"]
      },
      {
        "id": "post_receipt",
        "name": "Post Goods Receipt in SAP",
        "semanticType": "AccountingRelevantInventoryPosting",
        "businessMeaning": "Record inventory receipt in SAP MM (transaction MIGO), create accounting entry",
        "performer": "SAP User",
        "duration": "5-10 minutes",
        "durationMinutes": 7.5,
        "sequence": 3,
        "inputObjects": ["GoodsReceipt", "InspectionReport", "PurchaseOrder"],
        "outputObjects": ["SAPMIGOTransaction", "InventoryBalance", "AccountingEntry"],
        "systemsInvolved": ["SAP MM (MIGO)", "SAP Finance Module"],
        "isManual": false,
        "kpisAffected": ["cycle_time", "accuracy", "inventory_value"]
      },
      {
        "id": "match_invoice",
        "name": "Match Invoice to Goods Receipt",
        "semanticType": "ThreeWayMatching",
        "businessMeaning": "Match supplier invoice with PO and goods receipt for 3-way matching",
        "performer": "SAP User",
        "duration": "3-5 minutes",
        "durationMinutes": 4,
        "sequence": 4,
        "inputObjects": ["SAPMIGOTransaction", "SupplierInvoice", "PurchaseOrder"],
        "outputObjects": ["MatchingResult"],
        "systemsInvolved": ["SAP Invoice Verification (MIRO)"],
        "isManual": false,
        "kpisAffected": ["matching_accuracy", "cycle_time", "payment_delay"]
      }
    ],
    "decisions": [
      {
        "id": "quality_decision",
        "question": "Is the goods quality acceptable?",
        "businessMeaning": "Determine if goods meet quality standards and can be received",
        "outcomes": ["Accept", "Reject", "Hold for Engineering Review"],
        "frequencyPerOutcome": {
          "Accept": "89%",
          "Reject": "8%",
          "HoldForReview": "3%"
        },
        "owner": "Quality Engineer",
        "automationPotential": "Medium"
      },
      {
        "id": "variance_check",
        "question": "Does received quantity match PO?",
        "businessMeaning": "Verify goods quantity does not exceed acceptable variance",
        "outcomes": ["Matches", "Variance < 2%", "Variance > 2%"],
        "frequencyPerOutcome": {
          "Matches": "92%",
          "Variance < 2%": "6%",
          "Variance > 2%": "2%"
        },
        "owner": "Dock Supervisor",
        "automationPotential": "High"
      }
    ],
    "variants": [
      {
        "id": "variant_damaged",
        "name": "Damaged Goods Received",
        "trigger": "Quality inspection reveals damage > 5%",
        "frequency": "8%",
        "activities": [
          "receive_goods",
          "quality_inspect",
          "escalate_to_quality_engineering",
          "create_return_shipment",
          "contact_supplier"
        ],
        "impact": "Delays processing 3-5 days, cost impact €2000-5000"
      },
      {
        "id": "variant_quantity_variance",
        "name": "Quantity Variance (>2%)",
        "trigger": "Received quantity differs from PO by more than 2%",
        "frequency": "2%",
        "activities": [
          "receive_goods",
          "quality_inspect",
          "escalate_to_warehouse_lead",
          "contact_supplier",
          "adjust_po_or_return"
        ],
        "impact": "Inventory discrepancy, potential payment hold"
      },
      {
        "id": "variant_invoice_mismatch",
        "name": "Invoice Quantity Mismatch",
        "trigger": "Invoice quantity differs from goods receipt",
        "frequency": "5%",
        "activities": [
          "flag_invoice",
          "contact_supplier",
          "hold_payment",
          "resolve_discrepancy",
          "process_payment"
        ],
        "impact": "Payment delay 5-10 days, working capital impact"
      }
    ],
    "cycleTimeAnalysis": {
      "averageProcessingTime": "45 minutes",
      "averageWaitingTime": "2-3 hours",
      "totalCycleTime": "3-4 hours",
      "criticalPath": [
        "receive_goods (22.5 min)",
        "quality_inspect (27.5 min)",
        "post_receipt (7.5 min)",
        "match_invoice (4 min)"
      ]
    }
  },
  "semanticLayer": {
    "concepts": [
      {
        "id": "concept_goods_receipt",
        "name": "Goods Receipt",
        "definition": "A business transaction documenting the physical receipt of goods from a supplier and recording them in inventory",
        "semanticType": "InventoryTransaction",
        "synonyms": ["GR", "Wareneingang", "Goods Receiving", "Material Receipt"],
        "relatedConcepts": ["PurchaseOrder", "SupplierInvoice", "InventoryBalance"],
        "hierarchy": {
          "parent": "InboundLogisticsEvent",
          "children": ["StandardGoodsReceipt", "ReturnableGoodsReceipt", "ConsignmentReceipt"]
        },
        "owner": "Materials Management"
      },
      {
        "id": "concept_quality_check",
        "name": "Quality Inspection",
        "definition": "Process of examining received goods for defects, damage, correct specification, and compliance with purchase order",
        "semanticType": "QualityAssurance",
        "synonyms": ["QC Check", "Goods Inspection", "Quality Control", "Warenqualitätskontrolle"],
        "relatedConcepts": ["DefectRate", "InspectionCriteria", "AcceptanceCriteria"],
        "owner": "Quality Engineering"
      },
      {
        "id": "concept_three_way_match",
        "name": "Three-Way Matching",
        "definition": "Verification that purchase order, goods receipt, and supplier invoice match in quantity, price, and terms",
        "semanticType": "FinancialControl",
        "synonyms": ["3-Way Match", "3-Way Matching", "PO-GR-Invoice Match"],
        "relatedConcepts": ["PurchaseOrder", "GoodsReceipt", "SupplierInvoice"],
        "owner": "Finance/Procurement"
      }
    ],
    "businessObjects": [
      {
        "id": "obj_purchase_order",
        "name": "Purchase Order",
        "semanticType": "ProcurementDocument",
        "description": "Formal request to supplier for goods, quantities, prices, and delivery terms",
        "attributes": [
          "PONumber",
          "SupplierName",
          "OrderedQuantity",
          "OrderedPrice",
          "DeliveryDate",
          "Incoterms"
        ],
        "identifiers": ["PONumber", "SAPDocument"],
        "lifecycle": ["Created", "Sent", "Acknowledged", "PartiallyReceived", "Received", "Invoiced"],
        "owner": "Procurement",
        "system": "SAP MM",
        "relatedObjects": ["GoodsReceipt", "SupplierInvoice", "ReceiptSchedule"]
      },
      {
        "id": "obj_goods_receipt",
        "name": "Goods Receipt Document",
        "semanticType": "InventoryDocument",
        "description": "Record of goods physically received, inspected, and accepted into inventory",
        "attributes": [
          "GRNumber",
          "ReceiptDate",
          "ReceivedQuantity",
          "ReceivedCondition",
          "InspectionResult",
          "StorageLocation",
          "Lot/SerialNumber"
        ],
        "identifiers": ["GRNumber", "SAPTransaction"],
        "lifecycle": ["Draft", "InspectionPending", "InspectionPass", "Posted", "Reconciled", "Archived"],
        "owner": "Warehouse",
        "system": "SAP MM",
        "relatedObjects": ["PurchaseOrder", "SupplierInvoice", "InventoryBalance"]
      },
      {
        "id": "obj_supplier_invoice",
        "name": "Supplier Invoice",
        "semanticType": "FinancialDocument",
        "description": "Request for payment from supplier for goods delivered",
        "attributes": [
          "InvoiceNumber",
          "InvoiceDate",
          "InvoicedQuantity",
          "InvoicedPrice",